uid;abstract_id;conference_acronym;conference_place;creators_json;creator_names;creators_amount;creators_group_type;creators_group_publication;groups_with_female;creators_with_female_YN;creators_with_female_amount;creators_with_male_amount;creators_group_interdisciplinary;title;format_type
16083;83;DHd 2016;Leipzig;[{'affiliation': 'Institut für Maschinelle Sprachverarbeitung, Universität Stuttgart, Deutschland', 'name': 'Blessing, Andre'}, {'affiliation': 'Institut für Literaturwissenschaft, Universität Stuttgart, Deutschland', 'name': 'Bockwinkel, Peggy'}, {'affiliation': 'Institut für Maschinelle Sprachverarbeitung, Universität Stuttgart, Deutschland', 'name': 'Reiter, Nils'}, {'affiliation': 'Institut für Literaturwissenschaft, Universität Stuttgart, Deutschland', 'name': 'Willand, Marcus'}];"Blessing, Andre;Bockwinkel, Peggy;Reiter, Nils;Willand, Marcus";4;Kleingruppe;Kleingruppe_Poster;Kleingruppe_WAHR;WAHR;1;3;Kleingruppe_INTER;Dramenwerkbank - Automatische Sprachverarbeitung zur Analyse von Figurenrede;Poster
16084;84;DHd 2016;Leipzig;[{'affiliation': 'Universität Paderborn, Deutschland', 'name': 'Stotz, Sophia'}, {'affiliation': 'Universität Paderborn, Deutschland', 'name': 'Geierhos, Michaela'}];"Stotz, Sophia;Geierhos, Michaela";2;Duo;Duo_Poster;Duo_WAHR;WAHR;2;0;Duo_NICHT;Wie verhalten sich Aktionäre bei Unternehmenszusammenschlüssen? Modellierung sprachlicher Muster zur Analyse treibender Faktoren bei der Berichterstattung;Poster
16085;85;DHd 2016;Leipzig;[{'affiliation': 'Centrum für Informations- und Sprachverarbeitung (CIS), LMU, München', 'name': 'Zhekova, Desislava'}, {'affiliation': 'Centrum für Informations- und Sprachverarbeitung (CIS), LMU, München', 'name': 'Mikhaylova, Alena'}];"Zhekova, Desislava;Mikhaylova, Alena";2;Duo;Duo_Poster;Duo_WAHR;WAHR;2;0;Duo_NICHT;RuCoCo: Automatische Koreferenzannotationen für Russisch;Poster
16086;86;DHd 2016;Leipzig;[{'affiliation': 'Universität Konstanz, Deutschland', 'name': 'Butt, Miriam'}, {'affiliation': 'Universität Leipzig, Deutschland', 'name': 'Heyer, Gerhard'}, {'affiliation': 'Universität Konstanz, Deutschland', 'name': 'Holzinger, Katharina'}, {'affiliation': 'Universität Stuttgard, Deutschland', 'name': 'Kantner, Cathleen'}, {'affiliation': 'Universität Konstanz, Deutschland', 'name': 'Keim, Daniel A.'}, {'affiliation': 'Universität Stuttgard, Deutschland', 'name': 'Kuhn, Jonas'}, {'affiliation': 'Helmut-Schmidt-Universität, Universität der Bundeswehr, Hamburg', 'name': 'Schaal, Gary'}, {'affiliation': 'Universität Stuttgard, Deutschland', 'name': 'Blessing, André'}, {'affiliation': 'Helmut-Schmidt-Universität, Universität der Bundeswehr, Hamburg', 'name': 'Dumm, Sebastian'}, {'affiliation': 'Universität Konstanz, Deutschland', 'name': 'El-Assady, Mennatallah'}, {'affiliation': 'Universität Konstanz, Deutschland', 'name': 'Gold, Valentin'}, {'affiliation': 'Universität Konstanz, Deutschland', 'name': 'Hautli-Janisz, Annette'}, {'affiliation': 'Helmut-Schmidt-Universität, Universität der Bundeswehr, Hamburg', 'name': 'Lemke, Matthias'}, {'affiliation': 'Universität Konstantz, Deutschland', 'name': 'Müller, Maike'}, {'affiliation': 'Universität Leipzig, Deutschland', 'name': 'Niekler, Andreas'}, {'affiliation': 'Universität Stuttgard, Deutschland', 'name': 'Overbeck, Maximilian'}, {'affiliation': 'Universität Leipzig, Deutschland', 'name': 'Wiedemann, Gregor'}];"Butt, Miriam;Heyer, Gerhard;Holzinger, Katharina;Kantner, Cathleen;Keim, Daniel A.;Kuhn, Jonas;Schaal, Gary;Blessing, André;Dumm, Sebastian;El-Assady, Mennatallah;Gold, Valentin;Hautli-Janisz, Annette;Lemke, Matthias;Müller, Maike;Niekler, Andreas;Overbeck, Maximilian;Wiedemann, Gregor";17;Großgruppe;Großgruppe_Sektion;Großgruppe_WAHR;WAHR;6;11;Großgruppe_INTER;Argumentanalyse in digitalen Textkorpora;Panel
16087;87;DHd 2016;Leipzig;[{'affiliation': 'Universität Erlangen-Nürnberg, Deutschland', 'name': 'Evert, Stefan'}, {'affiliation': 'Universität Würzburg, Deutschland', 'name': 'Jannidis, Fotis'}, {'affiliation': 'Universität Erlangen-Nürnberg, Deutschland', 'name': 'Dimpel, Friedrich Michael'}, {'affiliation': 'Universität Würzburg, Deutschland', 'name': 'Schöch, Christof'}, {'affiliation': 'Universität Würzburg, Deutschland', 'name': 'Pielström, Steffen'}, {'affiliation': 'Universität Würzburg, Deutschland', 'name': 'Vitt, Thorsten'}, {'affiliation': 'Universität Würzburg, Deutschland', 'name': 'Reger, Isabella'}, {'affiliation': 'Universität Würzburg, Deutschland', 'name': 'Büttner, Andreas'}, {'affiliation': 'Universität Erlangen-Nürnberg, Deutschland', 'name': 'Proisl, Thomas'}];"Evert, Stefan;Jannidis, Fotis;Dimpel, Friedrich Michael;Schöch, Christof;Pielström, Steffen;Vitt, Thorsten;Reger, Isabella;Büttner, Andreas;Proisl, Thomas";9;Großgruppe;Großgruppe_Sektion;Großgruppe_WAHR;WAHR;1;8;Großgruppe_INTER;"'""Delta' in der stilometrischen Autorschaftsattribution""";Panel
16088;88;DHd 2016;Leipzig;[{'affiliation': 'Humboldt-Universität zu Berlin', 'name': 'Schelbert, Georg'}, {'affiliation': 'Deutsches Museum, München', 'name': 'Hohmann, Georg'}, {'affiliation': 'Herder-Institut für historische Ostmitteleuropaforschung, Marburg', 'name': 'Kuroczyński, Piotr'}, {'affiliation': 'Bibliotheca Hertziana - Max-Planck-Institut für Kunstgeschichte, Rom', 'name': 'Raspe, Martin'}];"Schelbert, Georg;Hohmann, Georg;Kuroczyński, Piotr;Raspe, Martin";4;Kleingruppe;Kleingruppe_Sektion;Kleingruppe_FALSCH;FALSCH;0;4;Kleingruppe_INTER;Arthistory's Next Topmodel? Der Trend zur Ontologie;Panel
16089;89;DHd 2016;Leipzig;[{'affiliation': 'Universität Paderborn, Deutschland', 'name': 'Greulich, Markus'}, {'affiliation': 'SICP – Software Innovation Campus Paderborn, Universität Paderborn, Deutschland', 'name': 'Oberthür, Simon'}, {'affiliation': 'Universität Paderborn, Deutschland', 'name': 'Karthaus, Nicola'}, {'affiliation': 'Universität Paderborn, Deutschland', 'name': 'Schmidt, Ariane'}, {'affiliation': 'Universität Paderborn, Deutschland', 'name': 'Wilk, Nicole M.'}, {'affiliation': 'Universität Paderborn, Deutschland', 'name': 'Stog, Kristina'}, {'affiliation': 'SICP – Software Innovation Campus Paderborn, Universität Paderborn, Deutschland', 'name': 'Senft, Björn'}];"Greulich, Markus;Oberthür, Simon;Karthaus, Nicola;Schmidt, Ariane;Wilk, Nicole M.;Stog, Kristina;Senft, Björn";7;Großgruppe;Großgruppe_Sektion;Großgruppe_WAHR;WAHR;3;4;Großgruppe_INTER;Mobile Anwendungen als multimodale Medien zur Vermittlung vormoderner Artefakte. Die ,Historisches Paderborn'-App – ein interdisziplinäres Forschungs- und Lehrprojekt;Panel
16090;90;DHd 2016;Leipzig;[{'affiliation': 'Beijing Institute of Technology, China, Volksrepublik', 'name': 'Wagner, Benno'}, {'affiliation': 'Universität Frankfurt', 'name': 'Mehler, Alexander'}, {'affiliation': 'Österreichische Akademie der Wissenschaften', 'name': 'Biber, Hanno'}];"Wagner, Benno;Mehler, Alexander;Biber, Hanno";3;Kleingruppe;Kleingruppe_Sektion;Kleingruppe_FALSCH;FALSCH;0;3;Kleingruppe_INTER;Transbiblionome Daten in der Literaturwissenschaft. Texttechnologische Erschließung und digitale Visualisierung intertextueller Beziehungen digitaler Korpora;Panel
16091;91;DHd 2016;Leipzig;[{'affiliation': 'Philipps-Universität Marburg, Deutschland', 'name': 'Bamberg, Claudia'}, {'affiliation': 'Philipps-Universität Marburg, Deutschland', 'name': 'Strobel, Jochen'}];"Bamberg, Claudia;Strobel, Jochen";2;Duo;Duo_Vortrag;Duo_WAHR;WAHR;1;1;Duo_NICHT;Editionsphilologie zwischen Bibliothek, Archiv und Fachwissenschaft: Der standardisierte Open-Source-Workflow der digitalen Edition der Korrespondenz August Wilhelm Schlegels;Vortrag
16092;92;DHd 2016;Leipzig;[{'affiliation': 'Universität Heidelberg, Deutschland', 'name': 'Bogacz, Bartosz'}, {'affiliation': 'Universität Heidelberg, Deutschland', 'name': 'Mara, Hubert'}];"Bogacz, Bartosz;Mara, Hubert";2;Duo;Duo_Vortrag;Duo_FALSCH;FALSCH;0;2;Duo_NICHT;Pattern Mining in Keilschriftzeichnungen;Vortrag
16093;93;DHd 2016;Leipzig;[{'affiliation': 'Universität Zürich, Schweiz', 'name': 'Bubenhofer, Noah'}];Bubenhofer, Noah;1;Single;Single_Vortrag;Single_FALSCH;FALSCH;0;1;Single_NICHT;Algorithmische Visualisierungen: Ausdruck von Routinen und Denkstilen in den Digital Humanities;Vortrag
16094;94;DHd 2016;Leipzig;[{'affiliation': 'Universität zu Köln, Kunsthistorisches Institut', 'name': 'Dieckmann, Lisa'}, {'affiliation': 'Ruprecht-Karls-Universität Heidelberg, Heidelberg Collaboratory for Image Processing (HCI)', 'name': 'Bell, Peter'}];"Dieckmann, Lisa;Bell, Peter";2;Duo;Duo_Vortrag;Duo_WAHR;WAHR;1;1;Duo_INTER;Die Kunst als Ganzes. Heterogene Bilddatensätze als Herausforderung für die Kunstgeschichte und die Computer Vision.;Vortrag
16095;95;DHd 2016;Leipzig;[{'affiliation': 'Universität Paderborn, Deutschland', 'name': 'Dunst, Alexander'}, {'affiliation': 'Universität Paderborn, Deutschland', 'name': 'Hartel, Rita'}];"Dunst, Alexander;Hartel, Rita";2;Duo;Duo_Vortrag;Duo_WAHR;WAHR;1;1;Duo_NICHT;Die Corpusanalyse multimodaler Erzählungen am Beispiel graphischer Romane;Vortrag
16096;96;DHd 2016;Leipzig;[{'affiliation': 'Georg Eckert Institut für internationale Schulbuchforschung, Deutschland', 'name': 'Fiedler, Maik'}, {'affiliation': 'Georg Eckert Institut für internationale Schulbuchforschung, Deutschland', 'name': 'Weiß, Andreas'}, {'affiliation': 'Institut für Informationswissenschaft & Sprachtechnologie, Universität Hildesheim', 'name': 'Heuwing, Ben'}, {'affiliation': 'Ubiquitous Knowledge Processing Lab, Deutsches Institut für Internationale Pädagogische Forschung / Technische Universität Darmstadt', 'name': 'Schnober, Carsten'}];"Fiedler, Maik;Weiß, Andreas;Heuwing, Ben;Schnober, Carsten";4;Kleingruppe;Kleingruppe_Vortrag;Kleingruppe_FALSCH;FALSCH;0;4;Kleingruppe_INTER;Automatische Textanalysen in der Geschichtswissenschaft – Auswertung, Interpretation und Relevanz;Vortrag
16097;97;DHd 2016;Leipzig;[{'affiliation': 'Universität Göttingen, Seminar für Deutsche Philologie', 'name': 'Göbel, Mathias'}, {'affiliation': 'Universität Göttingen, Seminar für Deutsche Philologie', 'name': 'Meiners, Hanna-Lena'}];"Göbel, Mathias;Meiners, Hanna-Lena";2;Duo;Duo_Vortrag;Duo_WAHR;WAHR;1;1;Duo_NICHT;Play(s): Crowdbasierte Anreicherung eines literarischen Volltext-Korpus;Vortrag
16098;98;DHd 2016;Leipzig;[{'affiliation': 'Albert-Ludwigs-Universität Freiburg, Deutschland', 'name': 'Gauer, Isabelle'}, {'affiliation': 'Max-Planck-Institut für Gemeinschaftsgüter, Deutschland', 'name': 'Hamann, Hanjo'}, {'affiliation': 'Albert-Ludwigs-Universität Freiburg, Deutschland', 'name': 'Vogel, Friedemann'}];"Gauer, Isabelle;Hamann, Hanjo;Vogel, Friedemann";3;Kleingruppe;Kleingruppe_Vortrag;Kleingruppe_WAHR;WAHR;1;2;Kleingruppe_INTER;Das juristische Referenzkorpus (JuReko) - Computergestützte Rechtslinguistik als empirischer Beitrag zu Gesetzgebung und Justiz;Vortrag
16099;99;DHd 2016;Leipzig;[{'affiliation': 'ACDH-OEAW Austrian Center for Digital Humanities, Österreich', 'name': 'Hannesschläger, Vanessa'}];Hannesschläger, Vanessa;1;Single;Single_Vortrag;Single_WAHR;WAHR;1;0;Single_NICHT;DH-Projekte Österreichischer Literaturarchive: Ein Problembericht;Vortrag
16100;100;DHd 2016;Leipzig;[{'affiliation': 'Katholieke Universiteit Leuven, Literary Studies Research Unit, Belgien', 'name': 'Gradmann, Stefan'}, {'affiliation': 'Georg-Eckert-Institut, Leibniz-Institut für internationale Schulbuchforschung, Deutschland', 'name': 'Hennicke, Steffen'}, {'affiliation': 'Humboldt-Universität zu Berlin, Institut für Bibliotheks- und Informationswissenschaft, Deutschland', 'name': 'Tschumpel, Gerold'}, {'affiliation': 'Universität Wien, Institut für Germanistik, Österreich', 'name': 'Dill, Kristin'}, {'affiliation': 'Max-Planck-Institut für Wissenschaftsgeschichte, Berlin, Deutschland', 'name': 'Thoden, Klaus'}, {'affiliation': 'Universität Bergen, Philosophisches Institut, Norwegen', 'name': 'Pichler, Alois'}, {'affiliation': 'Semedia, Università Politecnica delle Marche, Ancona, Italien', 'name': 'Morbindoni, Christian'}, {'affiliation': 'Max-Planck-Institut für Wissenschaftsgeschichte, Berlin, Deutschland', 'name': 'Stiller, Juliane'}];"Gradmann, Stefan;Hennicke, Steffen;Tschumpel, Gerold;Dill, Kristin;Thoden, Klaus;Pichler, Alois;Morbindoni, Christian;Stiller, Juliane";8;Großgruppe;Großgruppe_Vortrag;Großgruppe_WAHR;WAHR;2;6;Großgruppe_INTER;Modelling the Scholarly Domain beyond Infrastructure;Vortrag
16101;101;DHd 2016;Leipzig;[{'affiliation': 'Universität Göttingen, Deutschland', 'name': 'Herrmann, J. Berenike'}, {'affiliation': 'Universität Göttingen, Deutschland', 'name': 'Lauer, Gerhard'}];"Herrmann, J. Berenike;Lauer, Gerhard";2;Duo;Duo_Vortrag;Duo_WAHR;WAHR;1;1;Duo_NICHT;Aufbau und Annotation des Kafka/Referenzkorpus;Vortrag
16102;102;DHd 2016;Leipzig;[{'affiliation': 'National Research University - Higher School of Economics, Russland', 'name': 'Heßbrüggen-Walter, Stefan'}];Heßbrüggen-Walter, Stefan;1;Single;Single_Vortrag;Single_FALSCH;FALSCH;0;1;Single_NICHT;Modellierung: eine Begriffsbestimmung;Vortrag
16103;103;DHd 2016;Leipzig;[{'affiliation': 'Universität Wien, Österreich', 'name': 'Ivanovic, Christine'}, {'affiliation': 'Technische Universität Wien', 'name': 'Frank, Andrew U.'}];"Ivanovic, Christine;Frank, Andrew U.";2;Duo;Duo_Vortrag;Duo_WAHR;WAHR;1;1;Duo_INTER;Korpusanalyse in der computergestützten Komparatistik;Vortrag
16104;104;DHd 2016;Leipzig;[{'affiliation': 'Universität Potsdam, Deutschland', 'name': 'Laubrock, Jochen'}, {'affiliation': 'Universität Potsdam, Deutschland', 'name': 'Hohenstein, Sven'}, {'affiliation': 'Universität Potsdam, Deutschland', 'name': 'Thoß, Alexander'}];"Laubrock, Jochen;Hohenstein, Sven;Thoß, Alexander";3;Kleingruppe;Kleingruppe_Vortrag;Kleingruppe_FALSCH;FALSCH;0;3;Kleingruppe_INTER;Moving around the City of Glass;Vortrag
16105;105;DHd 2016;Leipzig;[{'affiliation': 'Freie Universität Berlin, Deutschland', 'name': 'Müller-Birn, Claudia'}, {'affiliation': 'Freie Universität Berlin, Deutschland', 'name': 'Schlegel, Alexa'}, {'affiliation': 'Humboldt-Universität zu Berlin', 'name': 'Baillot, Anne'}, {'affiliation': 'Berlin-Brandenburgische Akademie der Wissenschaften', 'name': 'Klawitter, Jana'}];"Müller-Birn, Claudia;Schlegel, Alexa;Baillot, Anne;Klawitter, Jana";4;Kleingruppe;Kleingruppe_Vortrag;Kleingruppe_WAHR;WAHR;4;0;Kleingruppe_INTER;Software-Einsatz in der geisteswissenschaftli-chen Forschungspraxis: Ergebnisse einer Umfrage;Vortrag
16106;106;DHd 2016;Leipzig;[{'affiliation': 'Medienzentrum/TU Dresden, Deutschland', 'name': 'Münster, Sander'}, {'affiliation': 'Lehrstuhl HCI/Universität Würzburg, Deutschland', 'name': 'Niebling, Florian'}];"Münster, Sander;Niebling, Florian";2;Duo;Duo_Vortrag;Duo_FALSCH;FALSCH;0;2;Duo_INTER;HistStadt4D - Multimodale Zugänge zu historischen Bildrepositorien zur Unterstützung stadt- und baugeschichtlicher Forschung und Vermittlung;Vortrag
16107;107;DHd 2016;Leipzig;[{'affiliation': 'Literature, Sciences and the Arts, Universitaet von Michigan, USA', 'name': 'McIsaac, Peter'}, {'affiliation': 'Electrical Engineering and Computer Science, Universitaet von Michigan, USA', 'name': 'Jamin, Sugih'}, {'affiliation': 'School of Natural Resources, Universitaet von Michigan, USA', 'name': 'Ibanez, Ines'}, {'affiliation': 'Electrical Engineering and Computer Science, Universitaet von Michigan, USA', 'name': 'Singer, Oskar'}, {'affiliation': 'Literature, Sciences and the Arts, Universitaet von Michigan, USA', 'name': 'Bray, Benjamin'}];"McIsaac, Peter;Jamin, Sugih;Ibanez, Ines;Singer, Oskar;Bray, Benjamin";5;Kleingruppe;Kleingruppe_Vortrag;Kleingruppe_WAHR;WAHR;1;4;Kleingruppe_INTER;Die Geowissenschaftliche Analyse von großen Mengen historischer Texte: Die Visualisierung geographischer Verhältnisse in deutschen Familienzeitschriften;Vortrag
16108;108;DHd 2016;Leipzig;[{'affiliation': 'Universität Leipzig, Deutschland', 'name': 'Meißner, Cordula'}, {'affiliation': 'Universität Leipzig, Deutschland', 'name': 'Wallner, Franziska'}];"Meißner, Cordula;Wallner, Franziska";2;Duo;Duo_Vortrag;Duo_WAHR;WAHR;2;0;Duo_NICHT;Die datengeleitete Ermittlung des gemeinsamen sprachlichen Inventars der Geisteswissenschaften;Vortrag
16109;109;DHd 2016;Leipzig;[{'affiliation': 'Justus-Liebig-Universität Gießen, Deutschland', 'name': 'Mihm, Melanie'}];Mihm, Melanie;1;Single;Single_Vortrag;Single_WAHR;WAHR;1;0;Single_NICHT;Weibliches Erzählen im Expressionismus? Eine Stilometrie von Mela Hartwigs Prosa;Vortrag
16110;110;DHd 2016;Leipzig;[{'affiliation': 'Freie Universität Berlin, Deutschland', 'name': 'Neubauer, Susanne'}];Neubauer, Susanne;1;Single;Single_Vortrag;Single_WAHR;WAHR;1;0;Single_NICHT;Small Data: Wissensproduktion und -vermittlung bei digitalen Visualisierungen in der Kunstgeschichte;Vortrag
16111;111;DHd 2016;Leipzig;[{'affiliation': 'pagina GmbH, Deutschland', 'name': 'Normann, Immanuel'}];Normann, Immanuel;1;Single;Single_Vortrag;Single_FALSCH;FALSCH;0;1;Single_NICHT;Digitale Editionen als Web-Services;Vortrag
16112;112;DHd 2016;Leipzig;[{'affiliation': 'Universität zu Köln, Deutschland', 'name': 'Rau, Felix'}, {'affiliation': 'Universität zu Köln, Deutschland', 'name': 'Blumtritt, Jonathan'}];"Rau, Felix;Blumtritt, Jonathan";2;Duo;Duo_Vortrag;Duo_FALSCH;FALSCH;0;2;Duo_NICHT;User-Experience von Spracharchiven: Eine Neubewertung der Interaktion von Archiv und Nutzern.;Vortrag
16113;113;DHd 2016;Leipzig;[{'affiliation': 'Universität Würzburg, Deutschland', 'name': 'Roeder, Torsten'}];Roeder, Torsten;1;Single;Single_Vortrag;Single_FALSCH;FALSCH;0;1;Single_NICHT;Sonification: Vermittlungsansätze zwischen Klang und Information;Vortrag
16114;114;DHd 2016;Leipzig;[{'affiliation': 'Karl-Franzens Universität Graz, Österreich', 'name': 'Scheuermann, Leif'}];Scheuermann, Leif;1;Single;Single_Vortrag;Single_FALSCH;FALSCH;0;1;Single_NICHT;Zu virtuellen Forschungsumgebungen, einer genuin digitalen Hermeneutik sowie deren Visualisierung;Vortrag
16115;115;DHd 2016;Leipzig;[{'affiliation': 'Friedrich-Alexander Universität Erlangen-Nürnberg, Deutschland', 'name': 'Scholz, Martin'}, {'affiliation': 'Friedrich-Alexander Universität Erlangen-Nürnberg, Deutschland', 'name': 'Goerz, Guenther'}, {'affiliation': 'Germanisches Nationalmuseum Nürnberg', 'name': 'Wagner, Sarah'}, {'affiliation': 'Germanisches Nationalmuseum Nürnberg', 'name': 'Fichtner, Mark'}];"Scholz, Martin;Goerz, Guenther;Wagner, Sarah;Fichtner, Mark";4;Kleingruppe;Kleingruppe_Vortrag;Kleingruppe_WAHR;WAHR;1;3;Kleingruppe_INTER;Darstellung heterogenen und dynamischen Wissens mit CIDOC CRM und WissKI;Vortrag
16116;116;DHd 2016;Leipzig;[{'affiliation': 'Leibniz-Institut für Länderkunde, Deutschland', 'name': 'Specht, Sebastian'}, {'affiliation': 'Leibniz-Institut für Länderkunde, Deutschland', 'name': 'Hanewinkel, Christian'}, {'affiliation': 'Leibniz-Institut für Länderkunde, Deutschland', 'name': 'Koslitz, Sebastian'}, {'affiliation': 'Leibniz-Institut für Länderkunde, Deutschland', 'name': 'Steller, Heike'}];"Specht, Sebastian;Hanewinkel, Christian;Koslitz, Sebastian;Steller, Heike";4;Kleingruppe;Kleingruppe_Vortrag;Kleingruppe_WAHR;WAHR;1;3;Kleingruppe_INTER;Tambora: Erkenntnisgewinne durch kartographische Visualisierungen von Forschungsdaten aus der historischen Klimatologie;Vortrag
16117;117;DHd 2016;Leipzig;[{'affiliation': 'Albert-Ludwigs-Universität Freiburg, Deutschland', 'name': 'Vogel, Friedemann'}];Vogel, Friedemann;1;Single;Single_Vortrag;Single_FALSCH;FALSCH;0;1;Single_NICHT;"'""Jesus ist keine App' - Fachsprachliche Konzeptualisierungen des ›Computers‹ und Ansätze computergestützter Fachsprachenlinguistik am Beispiel der Domänen Medizin und Theologie""";Vortrag
16118;118;DHd 2016;Leipzig;[{'affiliation': 'MLU Halle-Wittenberg, Deutschland', 'name': 'Kittelmann, Jana'}, {'affiliation': 'TU Dresden, Deutschland', 'name': 'Wernhard, Christoph'}];"Kittelmann, Jana;Wernhard, Christoph";2;Duo;Duo_Vortrag;Duo_WAHR;WAHR;1;1;Duo_INTER;Knowledge-Based Support for Scholarly Editing and Text Processing;Vortrag
16119;119;DHd 2016;Leipzig;[{'affiliation': 'Eberhard Karls Universität Tübingen, Deutschland', 'name': 'Zirker, Angelika'}, {'affiliation': 'Eberhard Karls Universität Tübingen, Deutschland', 'name': 'Bauer, Matthias'}];"Zirker, Angelika;Bauer, Matthias";2;Duo;Duo_Vortrag;Duo_WAHR;WAHR;1;1;Duo_NICHT;Annotation und Distant Reading: Probleme, Synergien, Perspektiven;Vortrag
16120;120;DHd 2016;Leipzig;[{'affiliation': 'Universität Stuttgart, Deutschland', 'name': 'Alscher, Stefan'}, {'affiliation': 'Technische Universität Darmstadt', 'name': 'Bender, Michael'}, {'affiliation': 'Universität Stuttgart, Deutschland', 'name': 'John, Markus'}, {'affiliation': 'Universität Stuttgart, Deutschland', 'name': 'Müller, Andreas'}, {'affiliation': 'Universität Stuttgart, Deutschland', 'name': 'Richter, Sandra'}, {'affiliation': 'Technische Universität Darmstadt', 'name': 'Rapp, Andrea'}, {'affiliation': 'Universität Stuttgart, Deutschland', 'name': 'Ertl, Thomas'}, {'affiliation': 'Universität Stuttgart, Deutschland', 'name': 'Koch, Steffen'}, {'affiliation': 'Universität Stuttgart, Deutschland', 'name': 'Kuhn, Jonas'}];"Alscher, Stefan;Bender, Michael;John, Markus;Müller, Andreas;Richter, Sandra;Rapp, Andrea;Ertl, Thomas;Koch, Steffen;Kuhn, Jonas";9;Großgruppe;Großgruppe_Vortrag;Großgruppe_WAHR;WAHR;2;7;Großgruppe_INTER;ePoetics – Korpuserschließung und Visualisierung deutschsprachiger Poetiken (1770-1960) für den ,Algorithmic Criticism';Vortrag
16121;121;DHd 2016;Leipzig;[{'affiliation': 'Berlin-Brandenburgische Akademie der Wissenschaften - Berlin, Deutschland', 'name': 'Boenig, Matthias'}, {'affiliation': 'Berlin-Brandenburgische Akademie der Wissenschaften - Berlin, Deutschland', 'name': 'Würzner, Kay-Michael'}, {'affiliation': 'Berlin-Brandenburgische Akademie der Wissenschaften - Berlin, Deutschland', 'name': 'Binder, Arne'}, {'affiliation': 'Centrum für Informations- und Sprachverarbeitung - Ludwig-Maximilians-Universität München, Deutschland', 'name': 'Springmann, Uwe'}];"Boenig, Matthias;Würzner, Kay-Michael;Binder, Arne;Springmann, Uwe";4;Kleingruppe;Kleingruppe_Vortrag;Kleingruppe_FALSCH;FALSCH;0;4;Kleingruppe_INTER;Über den Mehrwert der Vernetzung von OCR-Verfahren zur Erfassung von Texten des 17. Jahrhunderts;Vortrag
16122;122;DHd 2016;Leipzig;[{'affiliation': 'Zentrum für Musik- und Filminformatik, Hochschule Ostwestfalen-Lippe', 'name': 'Bohl, Benjamin W.'}, {'affiliation': 'Zentrum für Musik- und Filminformatik, Hochschule Ostwestfalen-Lippe', 'name': 'Berndt, Axel'}, {'affiliation': 'Software Quality Lab, Universität Paderborn', 'name': 'Senft, Björn'}];"Bohl, Benjamin W.;Berndt, Axel;Senft, Björn";3;Kleingruppe;Kleingruppe_Vortrag;Kleingruppe_FALSCH;FALSCH;0;3;Kleingruppe_INTER;Formate als Sackgassen: Handlungsempfehlungen;Vortrag
16123;123;DHd 2016;Leipzig;[{'affiliation': 'Lehrstuhl für Medieninformatik, Universität Regensburg', 'name': 'Burghardt, Manuel'}, {'affiliation': 'Lehrstuhl für Medieninformatik, Universität Regensburg', 'name': 'Wolff, Christian'}];"Burghardt, Manuel;Wolff, Christian";2;Duo;Duo_Vortrag;Duo_FALSCH;FALSCH;0;2;Duo_NICHT;Digital Humanities in Bewegung: Ansätze für die computergestützte Filmanalyse;Vortrag
16124;124;DHd 2016;Leipzig;[{'affiliation': 'Universität Leipzig, Deutschland', 'name': 'Goldhahn, Dirk'}, {'affiliation': 'Universität Leipzig, Deutschland', 'name': 'Eckart, Thomas'}, {'affiliation': 'Universität Leipzig, Deutschland', 'name': 'Heyer, Gerhard'}];"Goldhahn, Dirk;Eckart, Thomas;Heyer, Gerhard";3;Kleingruppe;Kleingruppe_Vortrag;Kleingruppe_FALSCH;FALSCH;0;3;Kleingruppe_INTER;Operationalisierung von Forschungsfragen in CLARIN-D - Der Anwendungsfall Ernst Jünger;Vortrag
16125;125;DHd 2016;Leipzig;[{'affiliation': 'Universität Bamberg', 'name': 'Gradl, Tobias'}, {'affiliation': 'Salomon Ludwig Steinheim-Institut für deutsch-jüdische Geschichte', 'name': 'Lordick, Harald'}, {'affiliation': 'Universität Bamberg', 'name': 'Henrich, Andreas'}];"Gradl, Tobias;Lordick, Harald;Henrich, Andreas";3;Kleingruppe;Kleingruppe_Vortrag;Kleingruppe_FALSCH;FALSCH;0;3;Kleingruppe_INTER;Judaica recherchieren – Unterstützung bei der Realisierung forschungsspezifischer Suchlösungen durch die generische Suche von DARIAH-DE;Vortrag
16126;126;DHd 2016;Leipzig;[{'affiliation': 'Universität Bamberg, Deutschland', 'name': 'Gradl, Tobias'}, {'affiliation': 'Universität Bamberg, Deutschland', 'name': 'Henrich, Andreas'}];"Gradl, Tobias;Henrich, Andreas";2;Duo;Duo_Vortrag;Duo_FALSCH;FALSCH;0;2;Duo_NICHT;Nutzung und Kombination von Daten aus strukturierten und unstrukturierten Quellen zur Identifikation transnationaler Lebensläufe;Vortrag
16127;127;DHd 2016;Leipzig;[{'affiliation': 'Universität Düsseldorf, Deutschland', 'name': 'Hellwig, Oliver'}, {'affiliation': 'Universität Düsseldorf, Deutschland', 'name': 'Petersen, Wiebke'}];"Hellwig, Oliver;Petersen, Wiebke";2;Duo;Duo_Vortrag;Duo_WAHR;WAHR;1;1;Duo_NICHT;Sprachwandel im Sanskrit? Eine Corpusstudie zum Einfluss Pāṇinis auf die Lexik des Sanskrit;Vortrag
16128;128;DHd 2016;Leipzig;[{'affiliation': 'Universität Hamburg, Deutschland', 'name': 'Jacke, Janina'}, {'affiliation': 'Universität Hamburg, Deutschland', 'name': 'Gius, Evelyn'}];"Jacke, Janina;Gius, Evelyn";2;Duo;Duo_Vortrag;Duo_WAHR;WAHR;2;0;Duo_NICHT;Kollaboratives Annotieren literarischer Texte;Vortrag
